{
  "format": "GridSecSim",
  "version": 2,
  "nodes": [
    {
      "id": "10000000-0000-4000-8000-000000000001",
      "node_type": "PMU",
      "label": "PMU-Example",
      "ip": "127.0.0.1",
      "port": 4712,
      "proto": "UDP",
      "level": 1,
      "reporting_rate": 30,
      "idcode": 1,
      "running": false,
      "active": false,
      "x": -180,
      "y": 300
    },
    {
      "id": "10000000-0000-4000-8000-000000000002",
      "node_type": "PDC",
      "label": "PDC-Example",
      "ip": "127.0.0.1",
      "port": 4713,
      "proto": "UDP",
      "level": 2,
      "buffer_timeout": 100,
      "pmu_input_count": 1,
      "x": 280,
      "y": 100
    },
    {
      "id": "10000000-0000-4000-8000-000000000003",
      "node_type": "THREAT_AGENT",
      "label": "MitM-Example",
      "ip": "127.0.0.1",
      "port": 0,
      "proto": "UDP",
      "level": -1,
      "active": true,
      "x": 50,
      "y": 200
    }
  ],
  "links": [
    {
      "src_id": "10000000-0000-4000-8000-000000000001",
      "dst_id": "10000000-0000-4000-8000-000000000002",
      "protocol": "C37.118",
      "threat_agent_ids": [
        "10000000-0000-4000-8000-000000000003"
      ]
    }
  ]
}

